{
  "analysis_contract_version": "2.0.0",
  "analysis_id": "growth-quadrant.v1",
  "resolution": {
    "bindings": {
      "year": "year",
      "group": "group"
    }
  },
  "normalization": {
    "profiles": []
  },
  "population": {
    "filters": [],
    "selection_sets": [],
    "family_mode": "records"
  },
  "parameters": {
    "date_role": "year",
    "category_role": "group",
    "long_start_year": 2020,
    "long_end_year": 2023,
    "short_start_year": 2022,
    "short_end_year": 2023
  }
}
