{
  "analysis_contract_version": "2.0.0",
  "analysis_id": "inventor-tracking.v1",
  "resolution": {
    "bindings": {"year": "year", "inventor": "inventor", "applicant": "applicant"}
  },
  "normalization": {"profiles": []},
  "population": {"filters": [], "selection_sets": [], "family_mode": "records"},
  "parameters": {"date_role": "year", "inventor_role": "inventor", "applicant_role": "applicant"}
}
