{
  "analysis_contract_version": "2.0.0",
  "analysis_id": "inventor-mobility-evidence.v1",
  "resolution": {
    "bindings": {
      "record_id": "record",
      "inventor_ids": "people",
      "date": "day",
      "classification": "ipc",
      "applicant_ids": "org"
    }
  },
  "normalization": {
    "profiles": []
  },
  "population": {
    "family_mode": "records",
    "filters": [],
    "selection_sets": []
  },
  "parameters": {}
}
