{
  "analysis_contract_version": "2.0.0",
  "analysis_id": "cooccurrence.v1",
  "resolution": {
    "bindings": {
      "item": "item"
    }
  },
  "normalization": {
    "profiles": []
  },
  "population": {
    "filters": [],
    "selection_sets": [],
    "family_mode": "records"
  },
  "parameters": {
    "category_role": "item"
  }
}
