{
  "analysis_contract_version": "2.0.0",
  "normalization": {
    "profiles": []
  },
  "population": {
    "filters": [],
    "selection_sets": [],
    "family_mode": "records"
  },
  "analysis_id": "matrix.v1",
  "resolution": {
    "bindings": {
      "x": "x",
      "y": "y"
    }
  },
  "parameters": {
    "x_role": "x",
    "y_role": "y"
  }
}
