{
  "analysis_contract_version": "2.0.0",
  "analysis_id": "composition.v1",
  "resolution": {
    "bindings": {
      "applicant": "出願人"
    }
  },
  "normalization": {
    "profiles": []
  },
  "population": {
    "filters": [],
    "selection_sets": [],
    "family_mode": "records"
  },
  "parameters": {
    "role": "applicant",
    "top_n": 10,
    "include_other": true,
    "measure": "count"
  }
}
